{
  "task_id": "TASK-20260325-001",
  "review_decision": "pass",
  "winner": "A",
  "final_summary": "A 组方案通过审核，已整理为单一对外结论，保留关键风险与后续动作，适合由主Agent 直接向用户输出。",
  "key_points": [
    "实现路径明确，主流程可复现",
    "关键约束与边界条件已补充",
    "已完成去重，避免向用户暴露内部竞争过程"
  ],
  "risks": [
    "部分恢复分支仍需补更多自动化测试",
    "A/B 竞争组的仲裁规则还可以继续细化"
  ],
  "next_steps": [
    "把最终结论交给主Agent 对外输出",
    "将恢复与默认接管细节继续回灌到主文档",
    "补充更多运行时样例用于回归验证"
  ],
  "dedupe_notes": [
    "已合并 A/B 重复论点",
    "已移除 reviewer 与 worker 的内部噪音描述"
  ],
  "sources": [
    "worker_a_result",
    "review_result",
    "runtime_results.json"
  ],
  "user_visible": true
}
